gpn-119|its desire to move from a regional to a global power. if you take a look economically at their discussions with regards to china 2025 and the top 10 industries that they're looking to impact|its desire to move from a regional to a global power. if you take a look economically at their discussions with regards to china twenty twenty fix and the top ten industries that they're looking to impact
gpn-120|industries like automotive|industries like automotive
gpn-121|pharmaceuticals, IT|pharmaceuticals, IT
gpn-122|industries that traditionally have been the purview of the united states are obviously the target of the chinese and perhaps the area that i would say is most challenging to us is the changing risk calculus we see with the chinese|industries that traditionally have been the purview of the united states are obviously the target of the chinese and perhaps the area that i would say is most challenging to us is the changing risk calculus we see with the chinese
gpn-123|a risk calculus that's informed militarily by their operations in the south china sea and the east china sea,|a risk calculus that's informed militarily by their operations in the south china sea and the east china sea,
gpn-124|diplomatically with their wolf diplomacy efforts,|diplomatically with their wolf diplomacy efforts,
gpn-125|economically with their belt and road initiative,|economically with their belt and road initiative,
gpn-126|and informationally|and informationally
gpn-127|with their continued operations against those that will challenge their message.|with their continued operations against those that will challenge their message.
